{
  "state": {
    "buttonevent": 1002,
    "lastupdated": "2017-04-11T02:00:26"
  },
  "config": {
    "on": true,
    "battery": 87,
    "reachable": true
  },
  "name": "Hue dimmer switch 1",
  "type": "ZLLSwitch",
  "modelid": "RWL020",
  "manufacturername": "Philips",
  "swversion": "5.45.1.16265",
  "uniqueid": "1234"
}